[
  {
    "unit_id": "sanctifiers",
    "faction_id": "agents-of-the-imperium",
    "models": [
      {
        "name": "Missionary",
        "profile_name": "Missionary",
        "min": 2,
        "max": 2,
        "default_weapon_ids": [
          "plasma-gun",
          "ministorum-flamer",
          "sanctifier-melee-weapon"
        ],
        "is_leader_model": true,
        "base_size_mm": {
          "shape": "round",
          "diameter": 25
        }
      },
      {
        "name": "Miraculist",
        "min": 1,
        "max": 1,
        "default_weapon_ids": [
          "holy-fire",
          "burning-hands"
        ],
        "is_leader_model": false,
        "base_size_mm": {
          "shape": "round",
          "diameter": 25
        }
      },
      {
        "name": "Salvationist",
        "min": 1,
        "max": 1,
        "default_weapon_ids": [
          "close-combat-weapon",
          "salvationist-medikit"
        ],
        "is_leader_model": false,
        "base_size_mm": {
          "shape": "round",
          "diameter": 25
        }
      },
      {
        "name": "Death Cult Assassin",
        "min": 1,
        "max": 1,
        "default_weapon_ids": [
          "death-cult-blades"
        ],
        "is_leader_model": false,
        "base_size_mm": {
          "shape": "round",
          "diameter": 25
        }
      },
      {
        "name": "Sanctifier",
        "min": 4,
        "max": 4,
        "default_weapon_ids": [
          "ministorum-hand-flamer",
          "sanctifier-melee-weapon"
        ],
        "is_leader_model": false,
        "base_size_mm": {
          "shape": "round",
          "diameter": 25
        }
      }
    ],
    "game_version": {
      "edition": "11th",
      "dataslate": "pre-launch-provisional"
    },
    "tiers": [
      {
        "models": [
          {
            "name": "Missionary",
            "min": 2,
            "max": 2
          },
          {
            "name": "Miraculist",
            "min": 1,
            "max": 1
          },
          {
            "name": "Salvationist",
            "min": 1,
            "max": 1
          },
          {
            "name": "Death Cult Assassin",
            "min": 1,
            "max": 1
          },
          {
            "name": "Sanctifier",
            "min": 4,
            "max": 4
          }
        ]
      },
      {
        "models": [
          {
            "name": "Missionary",
            "min": 2,
            "max": 2
          },
          {
            "name": "Miraculist",
            "min": 1,
            "max": 1
          },
          {
            "name": "Salvationist",
            "min": 1,
            "max": 1
          },
          {
            "name": "Death Cult Assassin",
            "min": 1,
            "max": 1
          },
          {
            "name": "Sanctifier",
            "min": 4,
            "max": 4
          }
        ]
      }
    ]
  },
  {
    "unit_id": "watch-captain-artemis",
    "faction_id": "agents-of-the-imperium",
    "models": [
      {
        "name": "Watch Captain Artemis",
        "min": 1,
        "max": 1,
        "is_leader_model": false,
        "base_size_mm": {
          "shape": "round",
          "diameter": 32
        },
        "default_weapon_ids": [
          "hellfire-extremis",
          "master-crafted-power-weapon"
        ]
      }
    ],
    "game_version": {
      "edition": "11th",
      "dataslate": "pre-launch-provisional"
    },
    "tiers": [
      {
        "models": [
          {
            "name": "Watch Captain Artemis",
            "min": 1,
            "max": 1
          }
        ]
      },
      {
        "models": [
          {
            "name": "Watch Captain Artemis",
            "min": 1,
            "max": 1
          }
        ]
      }
    ]
  },
  {
    "unit_id": "inquisitorial-chimera",
    "faction_id": "agents-of-the-imperium",
    "models": [
      {
        "name": "Inquisitorial Chimera",
        "min": 1,
        "max": 1,
        "is_leader_model": false,
        "base_size_mm": {
          "shape": "hull",
          "draft": true
        },
        "default_weapon_ids": [
          "multi-laser",
          "heavy-bolter",
          "lasgun-array",
          "armoured-tracks"
        ]
      }
    ],
    "game_version": {
      "edition": "11th",
      "dataslate": "pre-launch-provisional"
    },
    "tiers": [
      {
        "models": [
          {
            "name": "Inquisitorial Chimera",
            "min": 1,
            "max": 1
          }
        ]
      },
      {
        "models": [
          {
            "name": "Inquisitorial Chimera",
            "min": 1,
            "max": 1
          }
        ]
      }
    ]
  },
  {
    "unit_id": "callidus-assassin",
    "faction_id": "agents-of-the-imperium",
    "models": [
      {
        "name": "Callidus Assassin",
        "min": 1,
        "max": 1,
        "is_leader_model": false,
        "base_size_mm": {
          "shape": "round",
          "diameter": 32
        },
        "default_weapon_ids": [
          "neural-shredder",
          "phase-sword-and-poison-blades"
        ]
      }
    ],
    "game_version": {
      "edition": "11th",
      "dataslate": "pre-launch-provisional"
    },
    "tiers": [
      {
        "models": [
          {
            "name": "Callidus Assassin",
            "min": 1,
            "max": 1
          }
        ]
      },
      {
        "models": [
          {
            "name": "Callidus Assassin",
            "min": 1,
            "max": 1
          }
        ]
      },
      {
        "models": [
          {
            "name": "Callidus Assassin",
            "min": 1,
            "max": 1
          }
        ]
      }
    ]
  },
  {
    "unit_id": "inquisitor-greyfax",
    "faction_id": "agents-of-the-imperium",
    "models": [
      {
        "name": "Inquisitor Greyfax",
        "min": 1,
        "max": 1,
        "is_leader_model": false,
        "base_size_mm": {
          "shape": "round",
          "diameter": 32
        },
        "default_weapon_ids": [
          "castigation",
          "condemnor-stake",
          "master-crafted-power-sword"
        ]
      }
    ],
    "game_version": {
      "edition": "11th",
      "dataslate": "pre-launch-provisional"
    },
    "tiers": [
      {
        "models": [
          {
            "name": "Inquisitor Greyfax",
            "min": 1,
            "max": 1
          }
        ]
      },
      {
        "models": [
          {
            "name": "Inquisitor Greyfax",
            "min": 1,
            "max": 1
          }
        ]
      }
    ]
  },
  {
    "unit_id": "sisters-of-battle-immolator",
    "faction_id": "agents-of-the-imperium",
    "models": [
      {
        "name": "Sisters of Battle Immolator",
        "min": 1,
        "max": 1,
        "is_leader_model": false,
        "base_size_mm": {
          "shape": "hull",
          "draft": true
        },
        "default_weapon_ids": [
          "heavy-bolter-sisters-of-battle-immolator",
          "immolation-flamers",
          "armoured-tracks"
        ]
      }
    ],
    "game_version": {
      "edition": "11th",
      "dataslate": "pre-launch-provisional"
    },
    "tiers": [
      {
        "models": [
          {
            "name": "Sisters of Battle Immolator",
            "min": 1,
            "max": 1
          }
        ]
      },
      {
        "models": [
          {
            "name": "Sisters of Battle Immolator",
            "min": 1,
            "max": 1
          }
        ]
      }
    ]
  },
  {
    "unit_id": "inquisitorial-agents",
    "faction_id": "agents-of-the-imperium",
    "models": [
      {
        "name": "Inquisitorial Agent",
        "min": 5,
        "max": 10,
        "is_leader_model": false,
        "base_size_mm": {
          "shape": "round",
          "diameter": 25
        },
        "default_weapon_ids": [
          "agent-firearm",
          "agent-melee-weapon"
        ]
      },
      {
        "name": "Gun Servitor",
        "min": 1,
        "max": 2,
        "is_leader_model": true,
        "base_size_mm": {
          "shape": "round",
          "diameter": 25
        },
        "default_weapon_ids": [
          "heavy-bolter-inquisitorial-agents",
          "agent-melee-weapon"
        ]
      }
    ],
    "game_version": {
      "edition": "11th",
      "dataslate": "pre-launch-provisional"
    },
    "tiers": [
      {
        "models": [
          {
            "name": "Inquisitorial Agent",
            "min": 5,
            "max": 5
          },
          {
            "name": "Gun Servitor",
            "min": 1,
            "max": 1
          }
        ]
      },
      {
        "models": [
          {
            "name": "Inquisitorial Agent",
            "min": 6,
            "max": 10
          },
          {
            "name": "Gun Servitor",
            "min": 1,
            "max": 1
          }
        ]
      },
      {
        "models": [
          {
            "name": "Inquisitorial Agent",
            "min": 10,
            "max": 10
          },
          {
            "name": "Gun Servitor",
            "min": 2,
            "max": 2
          }
        ]
      },
      {
        "models": [
          {
            "name": "Inquisitorial Agent",
            "min": 5,
            "max": 5
          },
          {
            "name": "Gun Servitor",
            "min": 1,
            "max": 1
          }
        ]
      },
      {
        "models": [
          {
            "name": "Inquisitorial Agent",
            "min": 6,
            "max": 10
          },
          {
            "name": "Gun Servitor",
            "min": 1,
            "max": 1
          }
        ]
      },
      {
        "models": [
          {
            "name": "Inquisitorial Agent",
            "min": 10,
            "max": 10
          },
          {
            "name": "Gun Servitor",